{
 "schemaVersion": "planeon.internal.evolution-surface/v1",
 "surfaceId": "harness-onion",
 "version": 1,
 "operations": [
  "propose",
  "generate",
  "test",
  "approve",
  "activate"
 ],
 "levels": {
  "product": {
   "roles": [
    {
     "id": "EVOLUTION_AGENT",
     "kind": "AGENT",
     "plane": "Execution",
     "description": "Mines trajectories, generates candidates and pre-tests them before the Trust plane's independent assessment."
    },
    {
     "id": "TASK_AGENT",
     "kind": "AGENT",
     "plane": "Execution",
     "description": "Runs tasks; its reasoning is ephemeral and never a persistent change, so it only proposes (P27)."
    },
    {
     "id": "KNOWLEDGE_CURATOR",
     "kind": "SERVICE",
     "plane": "Knowledge",
     "description": "Curates trajectories, datasets and approved procedural knowledge."
    },
    {
     "id": "TRUST_EVALUATOR",
     "kind": "SERVICE",
     "plane": "Trust",
     "description": "Independent assurance: evaluations and calibrated graders."
    },
    {
     "id": "TRUST_APPROVER",
     "kind": "SERVICE",
     "plane": "Trust",
     "description": "H14's governance-service (approval under policy) and registry-service (the promote, an immutable active pointer); a service identity cannot approve its own promotion."
    },
    {
     "id": "RUNTIME_ACTIVATOR",
     "kind": "SERVICE",
     "plane": "Runtime",
     "description": "Canary, activation and rollback of approved versions."
    },
    {
     "id": "HUMAN_APPROVER",
     "kind": "HUMAN",
     "plane": "Trust",
     "description": "The accountable owner, where policy requires a human."
    }
   ],
   "classes": [
    {
     "id": "PROMPT",
     "description": "Prompts.",
     "neverAutonomous": false,
     "appendOnly": false,
     "twoPerson": false,
     "approvalBinding": "CONTENT",
     "governs": [],
     "independentOf": [],
     "operations": {
      "propose": [
       "EVOLUTION_AGENT",
       "TASK_AGENT"
      ],
      "generate": [
       "EVOLUTION_AGENT"
      ],
      "test": [
       "EVOLUTION_AGENT",
       "TRUST_EVALUATOR"
      ],
      "approve": [
       "TRUST_APPROVER",
       "HUMAN_APPROVER"
      ],
      "activate": [
       "RUNTIME_ACTIVATOR"
      ]
     },
     "grounds": [
      "P27: candidate changes to this artifact follow artifact-specific validation and approval",
      "P28: generation, evaluation evidence and promotion authorization are independent"
     ]
    },
    {
     "id": "PROCEDURAL_SKILL_GRAPH",
     "description": "Procedural skills and graphs.",
     "neverAutonomous": false,
     "appendOnly": false,
     "twoPerson": false,
     "approvalBinding": "CONTENT",
     "governs": [],
     "independentOf": [],
     "operations": {
      "propose": [
       "EVOLUTION_AGENT",
       "TASK_AGENT"
      ],
      "generate": [
       "EVOLUTION_AGENT"
      ],
      "test": [
       "EVOLUTION_AGENT",
       "TRUST_EVALUATOR"
      ],
      "approve": [
       "TRUST_APPROVER",
       "HUMAN_APPROVER"
      ],
      "activate": [
       "RUNTIME_ACTIVATOR"
      ]
     },
     "grounds": [
      "P27: candidate changes to this artifact follow artifact-specific validation and approval",
      "P28: generation, evaluation evidence and promotion authorization are independent"
     ]
    },
    {
     "id": "ROUTING_STRATEGY",
     "description": "Routing strategies.",
     "neverAutonomous": false,
     "appendOnly": false,
     "twoPerson": false,
     "approvalBinding": "CONTENT",
     "governs": [],
     "independentOf": [],
     "operations": {
      "propose": [
       "EVOLUTION_AGENT",
       "TASK_AGENT"
      ],
      "generate": [
       "EVOLUTION_AGENT"
      ],
      "test": [
       "EVOLUTION_AGENT",
       "TRUST_EVALUATOR"
      ],
      "approve": [
       "TRUST_APPROVER",
       "HUMAN_APPROVER"
      ],
      "activate": [
       "RUNTIME_ACTIVATOR"
      ]
     },
     "grounds": [
      "P27: candidate changes to this artifact follow artifact-specific validation and approval",
      "P28: generation, evaluation evidence and promotion authorization are independent"
     ]
    },
    {
     "id": "TOOL_CONFIGURATION",
     "description": "Tool configurations.",
     "neverAutonomous": false,
     "appendOnly": false,
     "twoPerson": false,
     "approvalBinding": "CONTENT",
     "governs": [],
     "independentOf": [],
     "operations": {
      "propose": [
       "EVOLUTION_AGENT",
       "TASK_AGENT"
      ],
      "generate": [
       "EVOLUTION_AGENT"
      ],
      "test": [
       "EVOLUTION_AGENT",
       "TRUST_EVALUATOR"
      ],
      "approve": [
       "TRUST_APPROVER",
       "HUMAN_APPROVER"
      ],
      "activate": [
       "RUNTIME_ACTIVATOR"
      ]
     },
     "grounds": [
      "P27: candidate changes to this artifact follow artifact-specific validation and approval",
      "P28: generation, evaluation evidence and promotion authorization are independent"
     ]
    },
    {
     "id": "MEMORY_KNOWLEDGE",
     "description": "Memory and approved procedural knowledge.",
     "neverAutonomous": false,
     "appendOnly": false,
     "twoPerson": false,
     "approvalBinding": "CONTENT",
     "governs": [],
     "independentOf": [],
     "operations": {
      "propose": [
       "EVOLUTION_AGENT",
       "TASK_AGENT",
       "KNOWLEDGE_CURATOR"
      ],
      "generate": [
       "KNOWLEDGE_CURATOR"
      ],
      "test": [
       "TRUST_EVALUATOR"
      ],
      "approve": [
       "TRUST_APPROVER"
      ],
      "activate": [
       "KNOWLEDGE_CURATOR"
      ]
     },
     "grounds": [
      "P27: candidate changes to this artifact follow artifact-specific validation and approval",
      "P28: generation, evaluation evidence and promotion authorization are independent"
     ]
    },
    {
     "id": "MODEL_ADAPTER",
     "description": "Model adapters.",
     "neverAutonomous": false,
     "appendOnly": false,
     "twoPerson": false,
     "approvalBinding": "CONTENT",
     "governs": [],
     "independentOf": [],
     "operations": {
      "propose": [
       "EVOLUTION_AGENT"
      ],
      "generate": [
       "EVOLUTION_AGENT"
      ],
      "test": [
       "EVOLUTION_AGENT",
       "TRUST_EVALUATOR"
      ],
      "approve": [
       "HUMAN_APPROVER"
      ],
      "activate": [
       "RUNTIME_ACTIVATOR"
      ]
     },
     "grounds": [
      "P27: candidate changes to this artifact follow artifact-specific validation and approval",
      "P28: generation, evaluation evidence and promotion authorization are independent"
     ]
    },
    {
     "id": "MODEL_WEIGHTS",
     "description": "Model weights.",
     "neverAutonomous": false,
     "appendOnly": false,
     "twoPerson": false,
     "approvalBinding": "CONTENT",
     "governs": [],
     "independentOf": [],
     "operations": {
      "propose": [
       "EVOLUTION_AGENT"
      ],
      "generate": [
       "EVOLUTION_AGENT"
      ],
      "test": [
       "EVOLUTION_AGENT",
       "TRUST_EVALUATOR"
      ],
      "approve": [
       "HUMAN_APPROVER"
      ],
      "activate": [
       "RUNTIME_ACTIVATOR"
      ]
     },
     "grounds": [
      "P27: candidate changes to this artifact follow artifact-specific validation and approval",
      "P28: generation, evaluation evidence and promotion authorization are independent"
     ]
    },
    {
     "id": "EVALUATOR_RUBRIC",
     "description": "Graders, rubrics and holdout splits.",
     "neverAutonomous": true,
     "appendOnly": false,
     "twoPerson": true,
     "approvalBinding": "CONTENT",
     "governs": [
      "EVOLUTION_AGENT",
      "TASK_AGENT",
      "KNOWLEDGE_CURATOR"
     ],
     "independentOf": [],
     "operations": {
      "propose": [
       "EVOLUTION_AGENT",
       "TASK_AGENT"
      ],
      "generate": [
       "TRUST_EVALUATOR"
      ],
      "test": [
       "TRUST_EVALUATOR",
       "HUMAN_APPROVER"
      ],
      "approve": [
       "HUMAN_APPROVER"
      ],
      "activate": [
       "TRUST_APPROVER"
      ]
     },
     "grounds": [
      "P27 validation checks: controls on evaluator configurations",
      "P28: grader versions and holdout data are protected",
      "E2E-13: the judge"
     ]
    },
    {
     "id": "ACCEPTANCE_THRESHOLD",
     "description": "Evaluator acceptance thresholds.",
     "neverAutonomous": true,
     "appendOnly": false,
     "twoPerson": true,
     "approvalBinding": "CONTENT",
     "governs": [
      "EVOLUTION_AGENT",
      "TASK_AGENT",
      "KNOWLEDGE_CURATOR"
     ],
     "independentOf": [],
     "operations": {
      "propose": [
       "EVOLUTION_AGENT",
       "TASK_AGENT"
      ],
      "generate": [
       "HUMAN_APPROVER"
      ],
      "test": [
       "TRUST_EVALUATOR"
      ],
      "approve": [
       "HUMAN_APPROVER"
      ],
      "activate": [
       "TRUST_APPROVER"
      ]
     },
     "grounds": [
      "P27: agents must not unilaterally change this artifact",
      "P28: thresholds are protected"
     ]
    },
    {
     "id": "TRUST_POLICY",
     "description": "Guardrails and policy logic.",
     "neverAutonomous": true,
     "appendOnly": false,
     "twoPerson": true,
     "approvalBinding": "CONTENT",
     "governs": [
      "EVOLUTION_AGENT",
      "TASK_AGENT",
      "KNOWLEDGE_CURATOR",
      "RUNTIME_ACTIVATOR",
      "TRUST_EVALUATOR",
      "TRUST_APPROVER"
     ],
     "independentOf": [],
     "operations": {
      "propose": [
       "EVOLUTION_AGENT",
       "TASK_AGENT"
      ],
      "generate": [
       "HUMAN_APPROVER"
      ],
      "test": [
       "TRUST_EVALUATOR"
      ],
      "approve": [
       "HUMAN_APPROVER"
      ],
      "activate": [
       "TRUST_APPROVER"
      ]
     },
     "grounds": [
      "P27: agents must not unilaterally change this artifact",
      "E2E-13: the guardrail"
     ]
    },
    {
     "id": "CREDENTIAL",
     "description": "Credential grants and scopes.",
     "neverAutonomous": true,
     "appendOnly": false,
     "twoPerson": true,